<?xml version="1.0" encoding="UTF-8"?>
<dataroot xmlns:od="urn:schemas-microsoft-com:officedata" xmlns:xsi="http://www.w3.org/2001/XMLSchema-instance"  xsi:noNamespaceSchemaLocation="Item.xsd" generated="2015-11-11T11:48:31">
<Item>
<ItemID>1</ItemID>
<ItemName>Basic Sword</ItemName>
<ItemType>WEAPON</ItemType>
<SubType>SWORD</SubType>
<Attack>5</Attack>
<AttackSpeed>1.2</AttackSpeed>
<Range>1</Range>
<MaxSize>1</MaxSize>
<Description>Basic well balanced sword</Description>
<Relic01>Basic Blade</Relic01>
<Relic02>Sword Hilt</Relic02>
</Item>
<Item>
<ItemID>2</ItemID>
<ItemName>Great Sword</ItemName>
<ItemType>WEAPON</ItemType>
<SubType>SWORD</SubType>
<Attack>7</Attack>
<AttackSpeed>0.6</AttackSpeed>
<Range>1.7</Range>
<MaxSize>1</MaxSize>
<Description>Large powerful sword, but very slow</Description>
<Relic01>Large Blade</Relic01>
<Relic02>Sword Hilt</Relic02>
</Item>
<Item>
<ItemID>3</ItemID>
<ItemName>Longsword</ItemName>
<ItemType>WEAPON</ItemType>
<SubType>SWORD</SubType>
<Attack>6</Attack>
<AttackSpeed>0.7</AttackSpeed>
<Range>2.2</Range>
<MaxSize>1</MaxSize>
<Description>Great reach, but slower</Description>
<Relic01>Long Blade</Relic01>
<Relic02>Sword Hilt</Relic02>
</Item>
<Item>
<ItemID>5</ItemID>
<ItemName>Health Potion</ItemName>
<ItemType>CONSUMABLE</ItemType>
<SubType>HEALTH</SubType>
<Attack>0</Attack>
<AttackSpeed>0</AttackSpeed>
<Range>0</Range>
<MaxSize>3</MaxSize>
<Description>Restores health</Description>
</Item>
<Item>
<ItemID>6</ItemID>
<ItemName>Mana Potion</ItemName>
<ItemType>CONSUMABLE</ItemType>
<SubType>MANA</SubType>
<Attack>0</Attack>
<AttackSpeed>0</AttackSpeed>
<Range>0</Range>
<MaxSize>1</MaxSize>
<Description>Restores mana</Description>
</Item>
<Item>
<ItemID>7</ItemID>
<ItemName>Sword Hilt</ItemName>
<ItemType>RELIC</ItemType>
<SubType>WEAPON</SubType>
<Attack>5</Attack>
<AttackSpeed>0</AttackSpeed>
<Range>0</Range>
<MaxSize>1</MaxSize>
<Description>Sword relic</Description>
</Item>
<Item>
<ItemID>8</ItemID>
<ItemName>Basic Blade</ItemName>
<ItemType>RELIC</ItemType>
<SubType>WEAPON</SubType>
<Attack>0</Attack>
<AttackSpeed>0.2</AttackSpeed>
<Range>0</Range>
<MaxSize>1</MaxSize>
<Description>Sword relic</Description>
</Item>
</dataroot>
